type,name,url,poster_url,description,rating,genre,datePublished,keywords,duration,actors,director,creator
Movie,Neelakanta,https://www.imdb.com/title/tt27142469/,https://m.media-amazon.com/images/M/MV5BMTk3MjIxMmQtZDVjZi00NTNlLThjYTQtNzlkNjNhMjZiZDIwXkEyXkFqcGdeQXVyMTA0MDMwNDEy._V1_.jpg,,,Action,,,,Mahendran | Yashna Chowdary | Appaji,Rakesh Madhavan,Rakesh Madhavan
Movie,Camera Ka Kamaal,https://www.imdb.com/title/tt26915700/,,Cinema is an one of the most valuable source for learning. in this film grandson tries to learn his idiot grandson to understand life.,,Drama,2023-04-29,learn,PT1H52M,Jakir Khan | Aarsh Alpesh Upadhyay | Tarika Tripathi,Dr. K.R. Devmani,Dr. K.R. Devmani | Milan Devmani
Movie,Dushu,https://www.imdb.com/title/tt27118862/,https://m.media-amazon.com/images/M/MV5BYjJmZjA1M2MtYWRiNy00ZGNjLWI0N2ItYzQ0ZWJjMGNlNzBlXkEyXkFqcGdeQXVyMzM2NDU0NzQ@._V1_.jpg,,,Adventure | Biography | Drama,,,PT1H42M,Manuj Sharma | Kaushal Kapoor | Shourya Tiwary,Himanshu Mishro Mondal,Himanshu Mishro Mondal
MusicVideoObject,Sun Meri Rani,https://www.imdb.com/title/tt27118481/,https://m.media-amazon.com/images/M/MV5BZGQwYjA4YmEtMjQ0OS00MmU4LTg5MzEtN2JmMGI1MjM5YWI1XkEyXkFqcGdeQXVyMTYyMjA3MzUz._V1_.jpg,"Sulu, an ambitious housewife, lives happily with her husband and her son. Things change when she wins a contest and auditions for a night show at a radio station.",,Music,2023-03-14,,,,,
Movie,Agwah,https://www.imdb.com/title/tt26687372/,https://m.media-amazon.com/images/M/MV5BNzZiMTZmYTYtOTE5MS00MmIyLWIwNzEtYjlkMTFhNjgyM2Y3XkEyXkFqcGdeQXVyMTYxMjkwNDU3._V1_.jpg,"A mafia men Faizal kidnaps a school girl named riya to blackmail her brother who is a security guard of local MLA. Faizal takes help from kabir in this kidnapping, who is not a regular criminal, kabir do this because his daughter ...",,Crime | Thriller,2023-02-10,"low budget film,crime thriller,low budget indipendent film,independent film",,Rajkumar | Sandhya Sharma,Guru Bhardwaj | Ravi Pandit,Guru Bhardwaj
Movie,Halloween 2020,https://www.imdb.com/title/tt23037024/,,"After terrorizing The Tri-State Area, BAD Baljeet as he is now known decides to drive down to Florida in a stolen car, with its warm balmy climate and laid-back environment, serves as the stronghold for Bad Baljeet, as he meticulo...",,Short | Horror | Musical,2023-05-20,,,Lj Ugarte | Dhruv Balaji,Dhruv Balaji,Dhruv Balaji
Movie,Continuity,https://www.imdb.com/title/tt26762833/,https://m.media-amazon.com/images/M/MV5BMWVkZGYyOWUtNWJhMC00YTMzLWJjNzItYWYyMDY3NmE4NDkzXkEyXkFqcGdeQXVyOTA1MDQ3OTI@._V1_.jpg,,,Short | Drama,,,PT23M,Phalguni Khanna | Karan Singh Chhabra | Jenny Sarkar,Deepak Singh,Deepak Singh | Mandeep Singh | Vikash Kumar Vishwkarma
Movie,Love & Lust,https://www.imdb.com/title/tt27112797/,,,,Short | Drama,2023-03-15,,PT30M,Ritika Ansari | Neha Gupta | Shekspear Shukla,Viral Bhatt,Viral Bhatt
Movie,The Face of the Faceless by Tri Light Creation,https://www.imdb.com/title/tt27304247/,https://m.media-amazon.com/images/M/MV5BY2NlN2IzZjktNDYwYS00OTQ1LWFmNjQtNzRlNGMzOWZkZTFkXkEyXkFqcGdeQXVyMTQ5OTI5NDkw._V1_.jpg,,,,2023-02-07,,,,,
Movie,Yah Mera Home town,https://www.imdb.com/title/tt26008430/,https://m.media-amazon.com/images/M/MV5BY2IzZWI1YTEtYTkwOS00YjQ0LWE0OGYtNzVjYTVjMGViMTBkXkEyXkFqcGdeQXVyMTU3ODc2MDIy._V1_.jpg,"We shot this video in Phagi, a village located in Jaipur district of Rajasthan state of India, there was a beautiful view at that place, one side pond filled with water and one side pad plants and at the",,Reality-TV,2023-01-01,,PT2H,Anushka Sen,,
Movie,The Investigation - Intazar Insaf Ka,https://www.imdb.com/title/tt27190451/,https://m.media-amazon.com/images/M/MV5BZjNmNDI4Y2QtMWUyMS00ZmEyLWI3YTgtNWM4YWQ2NTQ5YzhkXkEyXkFqcGdeQXVyMTU3MTg5MzA4._V1_.jpg,"How do law enforcers play with the law, how does the police investigate, does it even know how to investigate? Why does the common man consider the police not his friend but his enemy?",,Documentary | Short,2023-03-18,police investigation,,,Shailendra Pandey,Vibhas Awasthi | Shailendra Pandey
Movie,Kaala Barbarian Chapter 1,https://www.imdb.com/title/tt26445821/,,A surgeon who single-handedly tries to save his patient&apos;s life against all odds. Will he be able to protect an innocent family from the twisted plans of an organ trafficking mafia? What hidden truths will he unfold in the process?,,Thriller,2023-12-04,surgeon,PT1H49M,Srikanth Chaparala | Chayanika Chaudhuri | Vishal Chandrakant Jadhav,Jinto Chacko Samuel,Varun Singh Rajput | Jinto Chacko Samuel | Justin Shanti Thomas
Movie,Beluga,https://www.imdb.com/title/tt26754701/,https://m.media-amazon.com/images/M/MV5BNDQzN2ZkOWQtZGJhYS00NWZmLWJmNmMtOTUyZTMwMzNmN2RiXkEyXkFqcGdeQXVyMTYyNDQ4NzEz._V1_.jpg,"The story of a man who hopes to reconcile himself with his father&apos;s death, by leaving his life behind and retracing his father&apos;s journey across India - with a goat.",,Documentary,,,,Matthieu Ricard | Mathieu François,Mathieu François,Arunabh Bhattacherjee | Mathieu François | Aalok Padhye
MusicVideoObject,Dhuan Dhuan,https://www.imdb.com/title/tt26628208/,https://m.media-amazon.com/images/M/MV5BMjUzMWVhOGEtMWI5MS00ZTAzLWIwODQtYzc5Y2M5NzgxZmI1XkEyXkFqcGdeQXVyODQ2OTA5OTQ@._V1_.jpg,A brilliant musical composition holding a genre between an item number and a club song. This song is a perfect carol that includes the variations of melodic sections which welcomes the richness and loudness of its music. It is int...,,Music,,,,,,
Movie,Cybershot,https://www.imdb.com/title/tt27170368/,https://m.media-amazon.com/images/M/MV5BMzM4NDg5Y2EtYzU1Mi00MDhlLTlhNTctYmJlNjNmNzNjNGEzXkEyXkFqcGdeQXVyNTQ0ODk2MDI@._V1_.jpg,Iqbal and Tamanna find each other on a dating site and despite not being able to meet they fall deeply in love. Iqbal and Tamanna can&apos;t live without each other but unforeseen circumstances create a miserable situation. Tammana dec...,,Short | Thriller,2023-05-15,,PT29M,Sharib Hashmi | Keshavi Jaharia | Manu Malik,Keshavi Jaharia,Keshavi Jaharia
TVSeries,Piya Abhimaani,https://www.imdb.com/title/tt26768978/,https://m.media-amazon.com/images/M/MV5BNjM4NjVhYmItYzU5MS00NzMzLTg0MTgtOTU0OGRlZjU2MmM0XkEyXkFqcGdeQXVyMTYwMzA1MTg5._V1_.jpg,,,Drama,2023-02-27,,,Shalini Kapoor | Vaishali Arora | Aastha Sharma,,
Movie,Punish,https://www.imdb.com/title/tt27301544/,https://m.media-amazon.com/images/M/MV5BNjY3ZGE4OTktM2M4NC00ODVmLWEwNTQtODc1ODc3ZjRjYTE0XkEyXkFqcGdeQXVyMTYzNzc2NTk1._V1_.jpg,,,Short | Crime,2023-03-19,,,Preeti Chaturvedi | Anand Dev Mishra | Saurabh Talwar,Sunny Gautam,
Movie,Eternite,https://www.imdb.com/title/tt21139764/,https://m.media-amazon.com/images/M/MV5BNjY4ODNlMWEtMTk3Ni00MjI1LTk5OGMtMmY4YjUxNjM4MDU4XkEyXkFqcGdeQXVyMTUzODE2NzE5._V1_.jpg,A boy who makes an AI for his homework but that AI gets out of his control and copies itself in every smart electronic device in the world.,,Adventure | Sci-Fi | Thriller,2023-07-21,"artificial intelligence,artificial intelligence sci fi,eternity",,Lakshya Mishra | Shivam Saxena,Rudra Yadav,
Movie,To be or Not to be?,https://www.imdb.com/title/tt27204338/,https://m.media-amazon.com/images/M/MV5BMDYwOGVmODYtYWNhNy00NDljLThmMTEtNTE4ZDY1ZjUzZTJiXkEyXkFqcGdeQXVyMTU2ODMwMzYw._V1_.jpg,A depressed individual has given himself a month to live.He is unable to see hope and light in the world and everything seems gloomy.He has planned to live the last one month of his life and then commits suicide.,,Short | Thriller,2023-03-21,,PT12M,Gourav Gogoi,Rohit Chetry,Rohit Chetry
Movie,Anurag Kashyap,https://www.imdb.com/title/tt26475704/,,"A scientist brings together a struggling actor, a writer and a movie director for his unique experiment on the human brain. Set against the serene landscape of Benaras, the film delves into what would happen if a dream takes over ...",,Thriller,,,,Satyakam Anand,Abhay Singh,
Movie,Virangana,https://www.imdb.com/title/tt26240606/,https://m.media-amazon.com/images/M/MV5BZmVjNGY5ZDYtODgwYS00MDZlLWIxMmQtODAzYzFkMDhmZWE1XkEyXkFqcGdeQXVyMTA4ODU2NDEx._V1_.jpg,Story of self realization and breaking the chains. Dedicated to Rani Lakshmi Bai,,Short | Drama,2023-01-14,,,Shanaya Bhardwaj | Amarnath Kumar | Girish Pal,Kranti Pratap Singh,Kranti Pratap Singh
TVSeries,Kya Yahi Pyaar Hai,https://www.imdb.com/title/tt27141717/,https://m.media-amazon.com/images/M/MV5BYTllYjRhYWYtZWE1Yi00NDcwLTg4YTktZDMxZDE2ZGMyODc4XkEyXkFqcGdeQXVyMTU0MzgzNzQ5._V1_.jpg,,,Comedy,2023-03-03,tv mini series,,Rajesh Kumar | Shweta Chaudhary | Riya Singh,,
Movie,Pashchat Aur Pashchatap,https://www.imdb.com/title/tt27123435/,https://m.media-amazon.com/images/M/MV5BNDc5YTYxZTItZDIwZS00YzU2LTkzNzktNDkwM2EyODE5MmM4XkEyXkFqcGdeQXVyNjg2NTY2MDc@._V1_.jpg,"The main character is a rapist who gets pardon for the first time, does not get pardon for the second time and feels the pain of rape by cutting off his private part for the third incident.",,Short | Crime,2023-03-03,,PT6M,Ritu Dagar | Tarun Kumar,Naveen Bhardwaj,Naveen Bhardwaj
Movie,The Legal Battle - Intazar Insaf Ka,https://www.imdb.com/title/tt27079726/,https://m.media-amazon.com/images/M/MV5BZTgyN2Q4YzAtNDBmOS00YTIwLWJhYTktMzI3OWMxMGMyYTBjXkEyXkFqcGdeQXVyMTU3MTg5MzA4._V1_.jpg,This documentary shows the problems of Indian Judiciary system. More than 4 CR cases are pending in different courts of India.,,Documentary,2023-03-11,,PT48M,,Shailendra Pandey,Vibhas Awasthi | Shailendra Pandey
Movie,Roached,https://www.imdb.com/title/tt19856988/,https://m.media-amazon.com/images/M/MV5BZGEyZTg0NDItMmZkZS00N2Y1LTk5ZjYtODBlODZmZjliYmMwXkEyXkFqcGdeQXVyMjExMjU0Njg@._V1_.jpg,"Stuck at home amidst the COVID pandemic, a timid housewife finds her world unraveling due to the constant presence of her overbearing husband and a six legged intruder.",,Fantasy | Mystery,2023-03-13,,PT1H10M,Deeya Dey | Rudolfo Rajeev Hubert | Rohit Pareek,Kshitij Sharma,Deeya Dey | Kshitij Sharma
Movie,A Lullaby for Yellow Roses,https://www.imdb.com/title/tt26472702/,https://m.media-amazon.com/images/M/MV5BZjg1YTk4NWUtZTY5OS00MzY1LWEyNTAtOTM4YjMwMmQ1NWUxXkEyXkFqcGdeQXVyMTYxNTIxODU3._V1_.jpg,"A migrant working-class couple, after losing their daughter to an ill-fated destiny, seeks friends in each other.",,Short | Drama,2023-01-24,,PT18M,Trimala Adhikari | Somnath Mondal,Rahul Roye,Rahul Roye
Movie,Zindagi Tere Naan,https://www.imdb.com/title/tt26351098/,https://m.media-amazon.com/images/M/MV5BNTliOTAxOTEtYTVmOS00ZDQ3LWE0MzAtYzE2ZThjODBlZjU2XkEyXkFqcGdeQXVyMTU3NjM4MTk1._V1_.jpg,,,Romance,2023-03-08,,,Hasim Khan | Soheil Khan | Jaya Pandey,Anil Pandit,Anil Pandit
Movie,Prayaas,https://www.imdb.com/title/tt27330863/,https://m.media-amazon.com/images/M/MV5BZDQyM2VhZDMtOWJjYy00NTE1LThjMDMtZTgzODM1YzhmOGNhXkEyXkFqcGdeQXVyMTM0MjcwMDg1._V1_.jpg,"Prayaas is a story of 4 actors facing their own struggles in acting field, sharing the same bond. But an unfortunate incident occurs. Will the jealousy outshine the bond between them ????",,Short | Drama,2023-01-13,,,Kenil Kakadiya | Yash Kyatam | R Vikas Ram,Yash Kyatam,Yash Kyatam
TVSeries,Gusto with GD,https://www.imdb.com/title/tt15085696/,https://m.media-amazon.com/images/M/MV5BNGQwZjg4NTktNTk5OC00NTI3LThiMGUtNjQ0MTgwNDRlMWRlXkEyXkFqcGdeQXVyMTUzNzUyMzUz._V1_.jpg,"&apos;Gusto with GD&apos; is an entertainment talk show featuring a contrast of dynamic film and fashion celebrities, socialites, artists, etc. It&apos;s about Guts, Glory and Gusto",,Talk-Show,,,,G.D. Singh | Suchitra Pillai | Mihir Ahuja,,
MusicVideoObject,Khwaab: Shubhankit Sharma ft. Mansi Yelane & Riya Gupta,https://www.imdb.com/title/tt27217431/,https://m.media-amazon.com/images/M/MV5BZmM1MTlmNDktMDZhZS00Yzg1LWEwYzMtYTBiYmMyZmI3NDg3XkEyXkFqcGdeQXVyNjA4NTk0NjU@._V1_.jpg,,,Short | Music,2023-03-29,,,,,
Movie,Vo Ladki,https://www.imdb.com/title/tt13576680/,https://m.media-amazon.com/images/M/MV5BZTdlNzIwMjctY2VjYy00OThmLWIzNjYtNDVhZTE0ZWZiYjI3XkEyXkFqcGdeQXVyMTI2ODc3NDAw._V1_.jpg,"Pathik, decides to move on from every memory of Devyani and goes to meet her one last time with a thought of returning the wrist watch.",,Drama | Romance,2023-02-14,,,Dharmendra Ahirwar | Sanit Swami,Praween Kumar Pandey,Dharmendra Ahirwar | Shubham Vishwakarma
Movie,Part Time Job,https://www.imdb.com/title/tt26450229/,,"A 10-year-old boy, feel neglected by his parents who are hustling with work leading him to create his own separate world.",,Short | Drama,,,PT21M,Shreya Narayan | Hemanth Mahaur,Piyush Pandey,Piyush Pandey
Movie,See You in Hell,https://www.imdb.com/title/tt11133360/,https://m.media-amazon.com/images/M/MV5BNjIwYTQ2NjUtYzcwNC00Zjc0LTgyMzgtMGEzZGJlMGFkNjNmXkEyXkFqcGdeQXVyMTA4MjcwMTcz._V1_.jpg,5 DIRECTORS - 5 KINDS OF FEAR. Are you ready? To witness &apos;&apos;HELL&apos;&apos;,,Thriller,2023-04-30,,,,Rahul Chakraborty,
Movie,Sharif,https://www.imdb.com/title/tt15554750/,https://m.media-amazon.com/images/M/MV5BMTk2ZDYyYWEtNjVmYy00M2E3LTk0ZmUtNDZkMjI1ZGM0YWZjXkEyXkFqcGdeQXVyODkzMDM2NzI@._V1_.jpg,Three friends who have grown apart meet in the middle of the night. Memories pour out. We go on a journey from the age of landlines to that of smart phones. Sharif explores how disconnected we have become in an overly connected wo...,,,,,PT49M,Sidhant Deb | Arif Ahmed | Shweta Chaudhuri,,Sadhu
Movie,Khwaabon Mein Mere,https://www.imdb.com/title/tt27369537/,https://m.media-amazon.com/images/M/MV5BNDhmNjlkZDMtMzMwZS00ZTk3LTg0ZTYtYzBmM2M5MjVhMjMxXkEyXkFqcGdeQXVyOTA1MDQ3OTI@._V1_.jpg,Convergence of four different lives to one ultimate stage death. An award winning music video which will make you close to your loved ones directed by Kovid Mittal.,,Short | Music,2023-04-03,,,Kovid Mittal | Madhav Mohan | Thejaswini Sharma,Kovid Mittal,
TVSeries,Pratha,https://www.imdb.com/title/tt26470147/,https://m.media-amazon.com/images/M/MV5BOTAzN2Q3MDEtYzViZi00YWQ0LWE0OTItMjY0YzdjNzRiNWJjXkEyXkFqcGdeQXVyMTI0MDM3NzQx._V1_.jpg,A village is haunted by a horrible tradition that perturbs young men to refuse getting married . How a tradition ruins lives of young men and women what is behind this tradition how this tradition carried on by the mightiest headm...,,Drama,2023-01-02,,,Priom Gujjar | Aditya Roy | Rajat Shukla,,
Movie,Twinkle,https://www.imdb.com/title/tt26455384/,https://m.media-amazon.com/images/M/MV5BOWJjZDJhNmUtN2JhMC00MzdiLWEwODAtNTJjZWUwZWU4NzkxXkEyXkFqcGdeQXVyMTAwNjA5MTA3._V1_.jpg,,,Crime,2023-03-26,,,Avi | Sumiran Banerjee | Harish Gupta,Pramith Ganguly,Olivia Banerjee
Movie,Love In,https://www.imdb.com/title/tt24082668/,https://m.media-amazon.com/images/M/MV5BNDc2MTMxZjItODczMi00YTdkLTg0ZDktNWUwMDRlNDQzMTdiXkEyXkFqcGdeQXVyMTU2MzI4MDQ0._V1_.jpg,The story is a quirky kind of a love story which revolves around a boy coming from a lower middle class family struggling to become a director and a girl coming from an upper middle class family who already is an established chara...,,Short | Drama | Romance,,,PT25M,Deepshikha Banerjee | Ipsita Ganguly | Subrata Das,Shibaji Dutta,Shibaji Dutta
Movie,The Unbelievable Show: Made History,https://www.imdb.com/title/tt27040811/,https://m.media-amazon.com/images/M/MV5BMDZjOWI4YWEtMWVhMS00NWQ2LWFmMmYtYjkzOTc0M2QzNTg5XkEyXkFqcGdeQXVyMTMyMTY0Mzcx._V1_.jpg,"The Show Made an history two male singers have sung in female voice. In the Indian History First Time, Priyansh Jadav and Manish Jadav Made the Show Historical.",,History | Musical,2023-03-11,,,Priyansh Jadav,Priyansh Jadav,
TVSeries,Aamchi Mumbai,https://www.imdb.com/title/tt26936324/,https://m.media-amazon.com/images/M/MV5BNTZlOGNkMGEtZTE2Mi00YmIzLTg2OWQtM2I1ZGU1MGY0MzBiXkEyXkFqcGdeQXVyMTYyMzEzMjg5._V1_.jpg,"The story reveals the central character as a man of incomparable valour and extreme resilience. A martyr who sacrificed his life, putting his own life at risk for the nation, has been epitomized as the &apos;brave-heart&apos; in Aamchi Mumb...",,Action | Drama | Thriller,2023-01-30,,,Tejaa Deokar | Abhijeet Khandkekar,,
Movie,The Flamingos and Other Migratory Birds Tour,https://www.imdb.com/title/tt27147266/,,"In Mumbai, the city of migrants - dreams, love and longing intertwine. A newly arrived electrician struggles to keep his phone charged to talk to his wife in the village; a balloon vendor and his pregnant partner long for respite ...",,Short | Drama,2023-02-10,,PT30M,Chayanika Chaudhuri | Akshat Chauhan | Zahid Khan,Pranjal Dua,Pranjal Dua
Movie,Kaun Ho Tum,https://www.imdb.com/title/tt27218113/,https://m.media-amazon.com/images/M/MV5BYzNjNWQyZjctNDVhOC00YTJhLWExNzUtMzhmNzVmZTQxOWE3XkEyXkFqcGdeQXVyMTIzMDI2OTcx._V1_.jpg,Kaun Ho Tum is a commercial film based on friendship. The film is written and directed by Hans Raj Lohra and Hans Raj Lohra is the main protagonist of the film. The film is in Hindi language and has been shot at the beautiful loca...,,Family,,,,Komal Baha | Dhananjay | Hansika Jha,Hans Raj Lohra,Hans Raj Lohra
TVSeries,Serious Talk,https://www.imdb.com/title/tt25151578/,,Serious Talk is an Indian television comedy show that was first streamed on Raahi Productions YouTube Channel in January 2023. It was created by Dharmendra Ahirwar.,,Comedy,2023-01-01,,,Dharmendra Ahirwar | Varun Ahirwar,,
Movie,Salam-e-Madrasa,https://www.imdb.com/title/tt26695618/,https://m.media-amazon.com/images/M/MV5BOTU2YjdjMTEtMzlmYy00M2I1LWFiNDEtNjQxNTMzMjdkMTQ3XkEyXkFqcGdeQXVyMTYyMjI1NzEz._V1_.jpg,"The story revolves around 2 kids, Ali, and Imran studying at a rural Islamic school in India. They become friends with a rag picker, Bantu, while playing football at a nearby ground. Soon, they become good friends. Now, Bantu show...",,Drama,,,PT1H35M,Fazal Imam | Nishant Kumar | Anil Thakur,Shrey Rajdeo | Mohammed Muslim,Shrey Rajdeo | Anish Verma
Movie,Chalo Chalte Hain,https://www.imdb.com/title/tt27349102/,https://m.media-amazon.com/images/M/MV5BZDdkOWQxN2MtMWNjZi00YmJmLWFlMzYtNjVmMjdmODY4ZjEzXkEyXkFqcGdeQXVyODc3MTkzMTM@._V1_.jpg,,9.6,Short,2023-04-01,,,Ashwin Alok | Amaninder Kumar | Shubham Negi,Ashwin Alok,Ashwin Alok
Movie,Manduka,https://www.imdb.com/title/tt27097230/,https://m.media-amazon.com/images/M/MV5BZGU2ZDc0ZTktMjk1MS00NzZhLWI1NDItNTFhNGFkZDY5MTI0XkEyXkFqcGdeQXVyMTU0MDc2MjQx._V1_.jpg,A girl suffering from schizophrenia accidentally meets four criminals. Meanwhile in an hide and seek with Police and the criminals lies the mystery.,,Crime | Mystery | Thriller,,"2000s,true crime",PT1H44M,Anjala | Bhushan | Karuppu,Bhushan,Bhushan
Movie,Lazarus Herofication,https://www.imdb.com/title/tt16642882/,,"Some people who create conflicts for themselves. A cart loader fights for a meager load of gravel, A guy does foolish things in Love, A girl understands the importance of the Idea of God, A Boudoir artist saturated with beauty def...",,,2023-07-21,love,PT1H,Rashmi | Abhishek Hazari | Vinay Kumar,Dev Khajuriya,Dev Khajuriya
Movie,Sorry Mother,https://www.imdb.com/title/tt19733644/,,,,Drama | History,2023-01-30,,,Shantanu Bhamare | Anu Singh,Sanjay Amaan,Sanjay Amaan | Manoj Pandey
Movie,MMS Taxi,https://www.imdb.com/title/tt26933847/,https://m.media-amazon.com/images/M/MV5BZWU2NWI5YjEtNTM5OC00YTU5LTgzZmUtZGYyZDBlYzBlMzZiXkEyXkFqcGdeQXVyOTUwODQ5MjI@._V1_.jpg,,,Short | Drama | Romance,2023-02-22,,PT35M,Pravin Atulkar | Tanima Bhattacharya | Pulkit Mahendra,Jacob Paul,Jacob Paul
Movie,Sukhim,https://www.imdb.com/title/tt26765113/,,Sukhim portrays an inter state journey of a cricket player from Sikkim that turns to be one of the worst experiences of his life. After a tough struggle he gets selected as a player but due to the ongoing discrimination; despite o...,,Short | Action,2023-03-04,,PT14M,Ram Gujjar | Ram Pokhrel | Mahi Rathore,Raju Kafley,Ashutosh Agnihotri | Raju Kafley
Movie,Teri Meri Kahaani,https://www.imdb.com/title/tt19511828/,https://m.media-amazon.com/images/M/MV5BOTRkNDU0NjUtZWRmOS00NjY0LWE0ODktZTljY2VmZDUyNzkzXkEyXkFqcGdeQXVyODM4NTQ1MjI@._V1_.jpg,,,Musical,2023-03-16,,,Arpan Singh,Regan Dadu,Arpan Singh
TVSeries,Bundelkhand Cottage,https://www.imdb.com/title/tt26440720/,https://m.media-amazon.com/images/M/MV5BODI4ZmNkNDItZjgyZi00MjNiLWI2NzEtZGFlNmU5NGUxNWY2XkEyXkFqcGdeQXVyMTQwMzMyMjAy._V1_.jpg,,,Horror,2023-02-25,,,Arif Shahdoli,,
Movie,Perfect Couple,https://www.imdb.com/title/tt26863206/,https://m.media-amazon.com/images/M/MV5BZjMxMjA0MjMtNTIzNy00Y2Q0LThlYjctYWQwZWFmZmU0MTZjXkEyXkFqcGdeQXVyMjEwMDA5MDE@._V1_.jpg,Perfect Couple is a story about a loving couple. Things change when the husband shares a dark secret of his life with his wife on the occasion of the 25th Marriage Anniversary.,,Short | Family,2023-01-08,,,Prakaash Vir Arya | Simran Sharma | Abhishek Soti,Aryan Neeraaj Anand,Aryan Neeraaj Anand
Movie,Sexiest Mummy,https://www.imdb.com/title/tt27193235/,,,,Short | Romance,,,,,Gehana Vasisth,
Movie,Rudra the Power,https://www.imdb.com/title/tt26244480/,https://m.media-amazon.com/images/M/MV5BODBkYjA1MjQtOTE1OC00MzMwLWIzOTItOWZhOWJmZjMxODAzXkEyXkFqcGdeQXVyMTA0NjU0NTQ0._V1_.jpg,"Summary of the film;- This story is about dance bars. How a bar girl at the dance bar lives her life, what problems she faces, the disputes happening between the dance bar owners and the enmity being born out of it. Constant dispu...",,Action,2023-01-23,,PT1H10M,,Abhijeet,Abhijeet | Kuwar Manoj
Movie,No Tears Left to Cry,https://www.imdb.com/title/tt26695874/,https://m.media-amazon.com/images/M/MV5BMWViY2FhZDMtM2VkOS00N2YzLWI0MDQtYTZhNjlmMWFiMWMzXkEyXkFqcGdeQXVyNzM2NzUxODA@._V1_.jpg,Be who you are and say what you feel because those who mind don&apos;t matter and those who matter don&apos;t mind. Based upon true event.,,Biography | Drama,,,PT48M,Sukriti Gupta | Puneet Kumar Mishra | Bharati Perwani,Saif Baidya,
Movie,A Simple Film About Love,https://www.imdb.com/title/tt26345079/,https://m.media-amazon.com/images/M/MV5BMDc0ZGFmYmItMzdiMC00YmUxLTgyY2EtM2QzOTUxZDUxODNlXkEyXkFqcGdeQXVyMTQyMzM5MjY1._V1_.jpg,A simple documentary about different aspects of love across five generations - from the innocence of children to the wisdom of seniors - from cultures at the two ends of the world.,,Documentary,2023-01-18,,PT1H15M,,Anugraha Anil | Szabolcs Peto,Anugraha Anil | Szabolcs Peto
MusicVideoObject,Tumhe Mere Liye Hi Banaya Hai: Utkarsh Saxena ft. Abraz Khan & Priyanka Raut,https://www.imdb.com/title/tt27138112/,https://m.media-amazon.com/images/M/MV5BZmJkZTJhM2ItOTQ3My00ZjJjLWFiZDQtYTA1OWNlOTIxZjg2XkEyXkFqcGdeQXVyNjA4NTk0NjU@._V1_.jpg,,,Short | Music,2023-03-19,,,,,
Movie,Ruhani Ishq,https://www.imdb.com/title/tt21059382/,https://m.media-amazon.com/images/M/MV5BYWRjODY2NDUtZGM5Yi00ZjA1LTg3ZjQtMmE4YTY4MjU2YTM0XkEyXkFqcGdeQXVyMTEzMTA1NjYw._V1_.jpg,Ruhani Ishq is basically a romance genre film with the tagline Ho Bhi Jata To Kya Tha. Ruhani Ishq is a romantic film that unites Umesh and Sandeep for the primary time.,,Romance,2023-02-14,,,Manish Bambha | Saksham Bambha | Manoj Dogra,Yogesh Mishra,Sandeep Malik
Movie,Love Marriage,https://www.imdb.com/title/tt25398480/,https://m.media-amazon.com/images/M/MV5BMzI5NDJmZWEtNmE0MS00OTliLWFkOWYtYjNmY2Q2YjcwYmQ0XkEyXkFqcGdeQXVyMTU3MTg1Njkw._V1_.jpg,,,Short,2023-01-20,"love marriage,love marriage short film,love marriage knox aditya,love marriage new movie,love marriage short film sonu",,Knox Aditya | Harsh | Sanjana,Knox Aditya,Supratik Ganguly | Sonu | Veer
MusicVideoObject,Stalker,https://www.imdb.com/title/tt26596231/,https://m.media-amazon.com/images/M/MV5BNmQ2NjZjYTYtOWUyYS00NDAwLThmMTUtMGU1ZWE4Yjc0NjFiXkEyXkFqcGdeQXVyMTE5MTMwOTM2._V1_.jpg,,,Thriller,2023-01-22,,,,,
Movie,Age 29,https://www.imdb.com/title/tt21259912/,,"This is a comedy drama movie. Story is all about a boy who is a drunker , makes all the efforts (jugaad) to get some wine / whiskey / rum / vodka whatever possible after being forbidden by his mother. Once he makes his things brin...",,Comedy | Drama,,,,V S Prince Ratan | Darshan Shrivastava | Ankita,Kuldeep Singh,Kuldeep Singh
MusicVideoObject,Ab Ishq Kya?,https://www.imdb.com/title/tt26765613/,https://m.media-amazon.com/images/M/MV5BYzgwNjNmMWItZTU0OS00YmY2LWJjMTAtZTk3MjM4NmRmZTkwXkEyXkFqcGdeQXVyMTM0OTgxMTc4._V1_.jpg,,,Music,2023-02-19,,,,,
MusicVideoObject,Raat Baki,https://www.imdb.com/title/tt26629827/,https://m.media-amazon.com/images/M/MV5BMzNjMWE3OTQtYWM1Yi00MzZmLWI1NjUtNGNmYjI2ZjUwYThmXkEyXkFqcGdeQXVyMTM0OTgxMTc4._V1_.jpg,,,Music,2023-02-03,,PT4M,,,
Movie,Soo Jaa Mukesh,https://www.imdb.com/title/tt27206355/,,,,Drama,,,PT1H10M,Shreya | Vikrant Verma | Ananya,Devvrat Mishra,Devvrat Mishra | Niti Sharma
Movie,Bandit,https://www.imdb.com/title/tt22297928/,https://m.media-amazon.com/images/M/MV5BNDg4MmIzY2YtMmYxMy00YzdkLWI0MWMtY2Y4ODhlOTA0NWEwXkEyXkFqcGdeQXVyMTU2MzI4MDQ0._V1_.jpg,"Two brothers, Abdu and Ronny are on an ambiguous run from the police. While the younger one, Abdu is convinced their missing cult leader -- Shechem is dead, Ronny disregards it. They journey on an off-beat pursuit to find their lo...",,Short | Drama | Horror,,,PT12M,Adwait Dixit | Lakshya Parikh,Shawn Divakar,Shawn Divakar
Movie,Aakhari Din,https://www.imdb.com/title/tt27128061/,,,,Short | Horror,2023-01-08,,,,Bablu Singhaniya,Ranjan Tiwari
Movie,The Dark Face,https://www.imdb.com/title/tt26685948/,https://m.media-amazon.com/images/M/MV5BMWJkY2YwNGEtMzlkZS00YjYzLTk1NDItYWY5ZTJhNDIxNzcxXkEyXkFqcGdeQXVyMTM0MTM3MjQy._V1_.jpg,,,Action,2023-10-09,,,Shibam Samanta | Sanjay Kumar Mishra,Senthilkumar Alamuthu,Senthilkumar Alamuthu
Movie,Dream City Mumbai,https://www.imdb.com/title/tt11240928/,https://m.media-amazon.com/images/M/MV5BMjdkNDU1ZGQtODVjNS00ZWNlLTgzZDItYTdkNGUzZWMyNzk1XkEyXkFqcGdeQXVyNjA4NTk0NjU@._V1_.jpg,,,Mystery,,,,Ankita Bambulkar | Kalyanji Jana | Qaseem Haider Qaseem,Abdul Rahman Kazi,Mumtaz Nikhat
Movie,New York to Haridwar,https://www.imdb.com/title/tt18915468/,,,,Comedy,2023-01-30,,,Payal Ghosh | Shantanu Bhamare,Rajeev Chaudhari,Rajeev Chaudhari
